<?xml version="1.0"?>
<?xml-stylesheet type='text/xsl' href='scheduleSD.xsl'?>


<schedule xmlns:xsi="http://www.w3.org/2001/XMLSchema-instance"
xsi:noNamespaceSchemaLocation="schedule.xsd">
  <by_day> 
        <book_day day="Monday" >
            <class_time time="0930">
                <the_course number="ACIT4850" />
                <detail instructor="Jim" room="SW3-1750" type="" dur="2"/>
            </class_time>
        </book_day>
        <book_day day="Tuesday" >
            <class_time time="1130">
                <the_course number="ACIT4850" />
                <detail instructor="Jim" room="SW3-1750" type="" dur="2"/>
            </class_time>
        </book_day>
        <book_day day="Wednesday" >
            <class_time time="1230">
                <the_course number="ACIT4850" />
                <detail instructor="Jim" room="SW3-1750" type="" dur="2"/>
            </class_time>
        </book_day>
         <book_day day="Friday" >
            <class_time time="1430">
                <the_course number="ACIT4850" />
                <detail instructor="Jim" room="SW3-1750" type="" dur="2"/>
            </class_time>
        </book_day>
    </by_day>
    <by_time>
        <book_time time="0830">
            <week_day day="Tuesday">
                <course number="ACIT4620" />
                <detail instructor="Bethany" room="SE12-306" type="" dur="2"/>
            </week_day>
            <week_day day="Friday">
                <course number="ACIT4660" />
                <detail instructor="Steve" room="SW9-206" type="" dur="2"/>
            </week_day>
        </book_time>
        <book_time time="1530">
            <week_day day="Monday">
                <course number="ACIT4620" />
                <detail instructor="Bethany" room="SE12-306" type="" dur="2"/>
            </week_day>
            <week_day day="Wednesday">
                <course number="ACIT4660" />
                <detail instructor="Steve" room="SW9-206" type="" dur="2"/>
            </week_day>
        </book_time>
    </by_time>
    <by_course>
        <book_course number="ACIT4910">
            <this_week day="Monday">
                <blocks time="1530" />
                <detail instructor="Richard" room="SW9-206" type="" dur="1"/>
            </this_week>
            <this_week day="Thursday">
                <blocks time="0930" />
                <detail instructor="Richard" room="SW5-1840" type="" dur="1"/>
            </this_week>
            <this_week day="Thursday">
                <blocks time="1030" />
                <detail instructor="Richard" room="SE12-306" type="" dur="2"/>
            </this_week>
        </book_course>
    </by_course>
</schedule>

